{
  "$ref": "http://sports.core.api.espn.com/v2/sports/football/leagues/nfl/events/401220403/competitions/401220403/situation?lang=en&region=us",
  "lastPlay": {
    "$ref": "http://sports.core.api.espn.com/v2/sports/football/leagues/nfl/events/401220403/competitions/401220403/plays/4012204034370?lang=en&region=us"
  },
  "down": 4,
  "yardLine": 18,
  "distance": 12,
  "isRedZone": false,
  "homeTimeouts": 3,
  "awayTimeouts": 3
}
